text,document_id
coronavirus vaccines weakened link infections death says scientist,1
more aid arrives india struggles covid,2
hong kong risks global finance status covid isolation,3
economy expanded first quarter pointing fastest growth years,4
hong kong jobless rate falls third straight month one-year low,5
indias seven-day covid average new high,6
toshiba buy back shares pay special dividend,7
chinas banking regulator warns global asset bubble risks,8
stock investors celebrate red-hot five-quarter run,9
summer job market teens sweet,10
amazon wants make life easier heres changing grocery shopping,11
queen elizabeth meet joe biden person,12
biden cybersecurity order mandates new rules government software,13
sony  profit doubles helped gaming movies content,14
unemployment falls governments jobs shield,15
government top fuel supplier work secure pipelines closure enters fourth day,16
biden-putin geneva meeting focus cyber-hacking tensions,17
australia spend  hydrogen carbon capture projects,18
french daily covid infections rise,19
sri lanka faces ecological disaster burning container ship starts sink,20
english premier leagues top clubs post biggest collective loss history,21
equity futures trading higher morning  notched another record high despite surge consumer prices may,22
how smart digital payment system helps smes boost productivity,23
theres reason worry inflation,24
guggenheims scott minerd says bitcoin could sink,25
panasonic offloads tesla stake,26
china  commerce chiefs cooperate handling differences beijing says,27
microsoft invest usb malaysia set data centres,28
philippines says rice importers may shift cheaper indian grains,29
pandemic unemployment fraud may,30
records zero covid deaths first time year,31
million black american households negative net worth new study finds,32
microsoft buy artificial intelligence firm nuance usb,33
south korea  gdp beats expectations investment export bounce,34
economy accelerates  jobless claims edge lower,35
stock futures turn negative ahead labor data,36
chip shortage last least mid warns manufacturer,37
six big stocks post exciting fast gains  this dull market,38
suicide bombing indonesian catholic church wounds,39
biden calls congress reform  gun laws,40
wall streets roaring good gets,41
the ipo market has never been hotter than   right now,42
airline bank websites  another major internet failure,43
hotel industry struggling labor crisis,44
singapore corruption-related reports fall lowest years,45
weekly jobless claims fall lowest level nearly months,46
alaskas tourism economy frozen pandemic weighs cruise industry,47
indias southern states show resilience amid covid catastrophe,48
singapore set  maritime decarbonisation centre,49
display posts strong  profit panel price boost,50
